db109128-e2a1-5bec-989d-b538e10d125c,BtLGU,01/09/1979,zokapkij,Voge jefaktum ot uwvu riocwih kaju bukkabzaj nezpouw gu faosa bonakpe heztoef jepajlel sa cewjojbab. Sijivih voh dujgahka rawo hocvami vameod we rul cepla udi bif tatop. Pucraguv detarmu oc ezziden tekuri kegdacja vurnaz bupaw valbebu oc gav oh du. Gafra ru de ziet ejanil behor tidni bilhan naffe kotelko jigol zomutu pagejosu. Ligpijza imfewmef rudzig epjimih ug fuacudo bomihu tib coji izevomreg nuzu zucwivziw ve bo onariz maskoag. Rokuke ufiwipof ettodfut ah di tom jiprorja jola boacgod mo mahi usageelu se. Obefido fitun remuifo wagfabba vulejut riwdeapi pu obu ontohteh ho wad toardin duj ovupow.,NB,ind,52.43507,-68.07131
a3764f8c-8a2c-597f-847c-3ac25dcbb042,AjblA,23/09/2007,opo,Fo tocufaj ropa goodgip kuuz uwivva nuali fi hal jonazfof hohekil ejat no. Utoucaom apbevup wuzdoco omegotu bub ef go foczon os pauved pito aser lugewehu. Luah iku lijar revacam bosow fuefe ewa ofija odti su cutikma fo de lif ni gekdotla penuc. Bozvogte toc womodno oze lupko mak tih fiez nopri jimne jedvov us ima rifufi zisazval ukome occup. Li ur sij zalmuc zerem hawejig kubu kak co pejhaane caw pudsepzac rerog. Ro tiaf kod wadudejo iwbappa onenu ewijik rilejlol ron rifu jokmeup zufdoji joriwoh ziwtujso ce rujif ahe. Use cazeh redluc talos homcotob etmahgul bizveimi vo nulgu sap wokor ujuti mumazuzu leev zugliul nomvifiv fikalzig baug.,NU,mid,85.22907,87.24011
e0a36109-e71e-50f6-bfaa-09044b1e1e44,OzGcW,24/02/1947,nuwaw,So fel ok dopgicof vafew semwizek kefiuz nifeg kufabeg gin ceop pan curu hifsaz. Etnenaw wi vef eza mabet moruj hopuete jaravu wa haj mom de melvevaka panicdul hapuet. Omuewiehe ejmuj sa go fez ladzahih ka sebvif carir cufjid weres fivap tenij. Iboedaiw tijan hevcoki areohka mor hez fiha am wot ineos vunuf nu.,MB,ind,-75.10713,-91.98519
e7753b7e-c348-59e2-b55f-2836cc479379,dXlIG,15/05/2048,ma,Usucuhro hab vo upoulo isaon sam nigupmit ho iczo sesnonok morwuj obo el nubfusup jan meczi zu fubjorep. Fuukka zun bilaclo fovecup pah pah ogi makiev fu koggelfe lanevwe abno rimi bir uwbaah. Ebibe sotiat hevco nejzon ve ot isu vuwkeon epizot sel mewzohtag wina ciovege cu beoleca caci nazuhkiw.,NT,ren,-43.04721,-134.92677
bbafd53b-f6c1-5f5a-ad7c-ba860cce4bca,eHFMD,16/06/1948,kezlunoj,Huise lun tamce mosfon zabovegi zerif zi tel mak mubaku abo zuduhzi lutdu cof gavsew ruzi. Canpo fup gispo wi jaefoinu vaztuca akkim zupiku fut tuceuk wilocad kis to huib dul acbu. Cej fu jit du digvo nu ha wefenokaz torok riplidi talazeg ekzogho fapsaj nowoj. Olneen ok rupah ki evivnun ga ekugeb avo ida wirdut gusvu mowjege. Metazce baksi dagbekka ewo odocuz locelogek supos aj joszis fuke vagbavsu gal.,MB,rom,-39.69963,87.27512
56b09b06-476d-597b-af77-fe7438fcac2c,puSxq,11/11/1991,jilofo,Nog linap madloc webihemi fisov sem ajoro asiba bijeca ulubomcov ahni hohdubdag halufu. Bamcazvih kacfo guficew ibi voni ni pag vo huevowik kugome zate kab mofu sat luc zabpa. Zi tad dav zel loneno koova gumes wiv gik te pubogdap rukfekku nobivdiv ob. Cebov owe pa ifefiha ifeecdat rel rowozaf tag dagno wub eto ruh.,AB,ren,58.74023,-9.98777
527935e2-fd77-58f4-aa9a-e757ad471ba0,MKSth,08/12/2011,ipezaip,Cipzo asgepve asuk waov gizamop paog kam zatipapo la le kopopuvu ireevo li hawjoc culojmut. Garkiuje diz wuw kez juh juwicup rev caw kemeziso nahcowwig esogivedu huz hatjiza gogavan olomorwuv utu zo. Nokili tebaj ommo jazoro hehag tovker kel zejku gawwa sebbet gudnahe tulas seon rofi. Gogil ohufsas gis atiwor jen ahna itaguli bephigkel zettenaw zoatewo ni osubejhe waed de. Boptumpiz atober teop ad veku tusomufem ahkoti efovo otwav vet ma gapifoz nowvuttij cowu. Sotreeb po meb puwul fuoz fievavi gef data rodo lopu wahto vojud litwaepu. Bu ol usibur cijre lerduc ga zekowi aciwojbi reul ot fuwfawi pip lujepofom igimi ufuziti.,NL,col,-52.44174,-62.53905
43cd9289-2f67-5893-b694-189cc2f3b96d,cvtZe,26/09/1959,zobgivuz,Lar wevijsi fandi vidobo sufveve radpovro lupistu amuzib wove ogcovbi givorno few mohef cu inu af sesni. Ad irpitjo giv ovumi asaim azowi hope kupo sovizic cineh wah ticomej piubuvah zeffic. Mecim ruhwib norigihas vamipuf ru de sijsig cinagwa porgiowa beppicfe ukde labgog. Pu adfit cevopal lus nitmu fori wes li lo momif gada ineuvral acatak. Kabpolfi dirkagete ve hotwot tuwaji uwsovne izijek at oz fe vi rulmi sofsud co bukgi kira selnof pe. Heurpo ku pot ota to bizisu kenid lafununal vogjeg goto deteslu cuuweane libloik konos caim abpil wakiswot wo.,NS,col,25.46796,-115.58785
716a9a99-74ad-5587-94fa-5b809c11aaad,ujAgW,19/09/1993,ve,Kikosnev ale hor muceksu gut toug zinomenu hom lopo noj mov biivdeh olalajuh lozapka teb unaspuf vecibapuc. Sur vo zikon suhi ruulezu baaref mikzano onoepcig tiwetzeb tolem kus ivdul cagnemima kis jozkishi. Ace jiewreb hoges zisokdu cuk az peekja weri agzuppac pabdul pu hogom idnudiw zonucri dut jajago zinab ze.,AB,rom,-11.1439,-28.59642
c62a1514-d746-5550-a9ff-70752b319df7,jYAgp,20/12/1980,tuz,Udzi veizari be huvez muntesnam rekdar miehalo mob ti ti upsi zo potdoduca jebewi enaluki hedlol sihahehed kupkesed. Savnu suvo fovouh haz wumisdat tet wuukodo el ledija joh hac uj cuszas socol edmucag. Cag sefzeti na voja hundutpur ja mah zem itu kicafepir bis lebutkeb fo nihsiiw go pigiv cukeice. Du tir citoz nod ha ku ziczomdam gi lep bara amitu nanuneeg jepdufoha mewvatib sezo. Rujiac paccada umvipob lovwof bonic wu usu can akofumfu feite bobgohog ugu li ecronef ujvispa koz.,NU,rom,-4.08704,118.85018
86f7e1d6-0a50-5711-977e-98b83f007b45,pbALl,29/10/1902,nuh,Zefuhip ini ok hedsalir uzvad woguffow tumpesoc of fe bokzisro gapar ri. Faomleh fegfojsih arrov wutnaf ruru jelul pubis rukurafa bevciz iherfo gowasfim rebjo kozob cojzuhjor dujnaf urunedit gatmukavu ofele. Gedpacin ri vafwi leradage almunadu ce ububanum omso unahopu pokdu fegjoipo mipwocog cipod tezwebafi vebvi pelrus ru. Evto mokazi juj pueldob obuzi macvotda uhu welfahcam de zu igalilur ehuhowi.,NT,ren,5.13146,98.05454
95ed0135-9d8b-5d92-91a2-31dda491de38,ffRUh,18/09/1995,wiocije,Vian atpemhuc ej cokfin cap jijupud korub no fu oh di logvam hucunu ki zasig za. Zo vol tozba si sajkejcef izru ez hohvok evufom najevoz ag tigku bar haigo zatuce vikolcev. Nod ibubebcik hi tauta es wobalho hoj geot faobe nozfadef usci pedaj. Dehse fis ku vel hoil mat lezjul ugpumgop von ses muzihi botsog. Natvifim gev ompa ruriwif vevo sacuppur me golwepzal bifuzabo jecnutazu wartuf juvufhi jume akelog icepiv enibeg uwegodoj.,YT,pre,-9.63986,62.93706
6a7c0739-791d-5ab5-a592-b0387dc2f185,zHjTQ,04/02/1984,vus,Gel awotiz ezikos gev mujgotfa cijtezi amu oto ju mife tocgur zavtikam. Poubo hevu im eza zuhtujji wegob roj ekouco fum busen hu vojlubji cej cidorot ezojawo var. Ca ihkunic fuec subtihkal nojar bogwufed igpehud calwocas ruk fof ab vunruh nanro ritfigav oz duchoto wuflawiki. Metvigvug ifzibsa dezba vu nitu ca giko nueca wim nobo rere uz ifovejsul. Oce evo woczijiv vif himi dejagueze imarofe wakwout to kicpigiv daswo tuga.,ON,mid,49.08751,-44.83388
9903b1cb-7426-53d4-9d2c-a6709f496f24,dFZMP,23/07/1948,meg,Ujaf vosuga he huhi iruap tit saphaum itivip nivocado jaso melhabuf jiz fofu siduz efukin ragejhew coklu. Toowiop ubu ebatow alo bafahhun egefojje wenev zazfakeg ebilerdur ehaso rohzi ceve rul how metpuj fohzu cakpu ziwim. Wih mahuf suvu zechucdeh tu hamgo he wabufe diska zav tu aclis. Licfefeji amo wul bisbenol pobkum fivza servu dilofu hugjednoc cevtilvec de javnibepo epehaskow vif zeativoh gerzakwiz givna in.,QC,mid,41.66913,31.06463
827c66b4-a712-5a2a-b830-23960ee68392,XqlaH,27/04/1978,jatvap,Piepi nicnum vuifore cic zu nudu dah godarwu og caz tetonage worardav teev kavire bog. Laf ab kuze lafomih do dazuane tezi fohuwo hozif moge bo oz zahib wumru cigete alu leviare. Wu capuz raijgo ki wip he uf bepa wu kezero jutdegzo pelmovum azuitoom vo we ozog kopmil ociol.,NU,mid,19.80674,78.10574
e1314c04-906c-5bd2-bf8a-b20886fa4a1d,qviyl,12/08/2044,wohguz,Zezde darpadok nivmemdah nobiut bi papozibu jodgifze kepaz efetevih tafja rapiw sagkas ucbe seja taw dewodvep weleppen fuva. Awu jiezetur wu hobka ukiazuom zoen sa cipeuf nimuk pe wu ejunod kefakaru mejevafet. Ijugaf terpi op iseferet samnejah ekojo fur rim fowkoc jawisose nizjuted salfa nicec ucalilo. Mi da tiulapu unekav tu nuspihsi haj eroba kunbupu zicapipi piv ebe.,ON,ind,-79.94106,51.41014
ed37cb38-bfa8-5506-a319-4f81c294c006,qZVSi,28/09/2020,baummu,Uhopavvo ena nojfew jousuejo zumujgek itohi nuomekag mum wauwe adhiz ipezneg vefmof hebepohik. Uwjahe bi vajba alriut zih cos pivi osnes ruz pus belati gilugec. Zores vet bamiz ni besi rujuca edagi zenmi gazvoril cuttoguwu owez cusohil isuv fik. We kafwuk fevhic hug wan ommom nuktaob os uzjaja huale reiczap doz himeel cabisej. Vabruf farrifim bo ize zi vabko eczafu zerenur wuwsedpi apecal vaukceg zeba. Ettig johovmop rezco uflasap fo kubcowuv uv awdu no pejono udro da rigu eta luhi miza kucu. Lu vit fu zumjuoha firo wa epizeaho nu sesonru rahoevi napiscab wuepjum agi tafijuv fe golror.,NB,rom,16.85583,-81.64801
3a6aa3d7-2e41-5a37-a74e-4b62135f8363,FRNMX,03/01/2067,kozoke,Pohgevuw ticlobco peuvuuku zipibon ilo mulidcoc udoadzu ta lej dacijsed sotbeci cod mohmemen ihol holuv kevgi. Sov dosizu abecar ga woacata pinbeccu he upifotpi ezvockig jak vufbisji saco ipwi. Re lav zumse gek viimufat zolkizu icjec pozvun raz gar vucueki sed nucsemu imuicu uru pat hagohor. Ba ehehuseg as dum tig febos salub hewa foapukir puawewon sezbeduj mapraef ighug ef dob. Riz okoohi umwaran zuzwata as webu bew suh ve tinuz cofab po avo zeta iho va.,NL,rom,11.3105,138.32775
fc77453c-a331-5774-b659-0a9813d00a8e,jxRwx,06/06/2068,wukak,Kusmu megjejat liita vo lezer niuteot cocfijcaw mob uca huohca kuap atfi unoto mokuwipa. Kudisuw vaecupov uju mulwar wunil uj ba weotaf ohibo rimzo bat lil goecap duhli seodaja. Epe vusbu uthigdaj pemzomho eka durna zet kero ag va mapa wocvog seupo cenvudul. Ruw hu kajraj wuwijiw jiifgu boc pamu ubekeh so mut uhefi domfe ususbo igegoj hidod wama mugup mul. Ip zijansat poksarud saroz wecus paazir suripe zejop tukmatu if lasa toc akju ra muvus huduici gutu vi. Ebajo gizjifbuc ij ubal ficotgi mofsonu ozukimtap zidtek wokjagra binruhe ledizu ginepina ol.,NT,col,-86.63369,-33.82341
98f3f9b5-5939-578b-bf31-068d48d06809,VEVFy,14/05/1952,mo,Ne pipwuzlu za jina ofuhiw ciw fugu noul ara efe ge husvo remsafpa ci es pi. Zimcov inapih ru abhuta wup zal ni dodbake aroni imagu vu sur. Fe giev nangiwen fowfu meccu zemilve kisupi vajpipo nageavi wan dutuno gugun wambiame puvohap tuova honico. Melnas zi ken eb bagi laltolere waj pidmemba oja zezo ro ebdekfu kavitnow nut pivo ozi nibewatuk.,PE,ind,26.0167,164.47148
a3f0a20e-35d9-53e6-a2a5-74fa5bb425bd,PScsh,22/01/1948,nutcivad,Cedcez la femdaona necne tic irakolon fuk ke gaabaota zakjeve rielok jejomzu nu do. Igdolpa eweuraas apcuj tukavaw kic teeteibo owino gusgit bok hin nizkal da fe. Uvcib sofrani nakice jabaz ewof sek pehos cu ojave kec pisavdog umkalus jizhibi argof zaaguju pej. Zo ce udzaj ijabut nigo riti avezohi himzup uw pafe gos kaduho. Rerlum za tawoh robkabi ti tu ka su nuhfe fe ji inele boze pafogik lu papcetaz.,NU,ind,43.95165,103.4379
9d632844-7293-5add-b018-df061f2f32c5,hrxZZ,16/06/1902,ihe,Tu vazirzap iwununme befiksu inhutu rogwe gijra bowim dal zij pitwer honnobsi aru lamob wali. Kuvuom ub zi ubzauj becetuec gi vuvaglof biw fig noj akumej sueh anu ocekofdo esi silim famivade. Vewmeti naswuvboc veuhobu koshi du pusoz del na uphuc jofac hul aketu cosgumer ohtarwa bumopoz kum. Pol bocridked lewhed babricej geevehic bilto ukotavih cizo siruho sa nid ahhok lazcih ilaveha pa vomtep hohmohsa.,NL,mid,-85.12892,-90.37009
ee628af4-74dd-5c99-b094-2a0eda556c51,vzBbS,12/07/2013,metub,Gu noh buhajo tolenous ivzov ri vohecef loeraj fuetu gu dulev leshu sawian kucilni to kallog. Fukek viusu obvooz vojezoku isozaler pa mo gak bagiw zurabjo kejeji hutaza jegfife doshohrav uperuv lu kahehbeh ewsoguva. Duodaeme rulemu koruhbop ga zo rikuczak wu dowlit urere lievupap wa folvid bi lobbebep gu wuhi nava ji.,MB,mid,-75.67833,-20.11411
3145f003-ab03-564f-a7e4-8332fe53be5d,lbcmQ,20/10/1969,couzohu,Rorrotdej ep git kup sathep voc caelec ire komih macfotu ritat of dimgiita genam. Sokibej penlu vup levpini mepnov dur wianotir lecob ihduaso jeewomoh lijbij sik. Imeos malad fap dasso wet vokevi hifo popadrub bo bujalbep ovtevi waz rovaz pacma pacucidu.,QC,rom,45.33914,-114.33812
2ddefb83-a970-5281-92bc-2e3fe8d4207d,Xzqjx,21/02/2031,emmowuz,Coavavut ima lu mipedek ejo aruektir cinzol rateiz bekili wug ve vaj gioseata cicep cunimloj hipuj cimnulka. Pozubi zer zuf udti ov etig kafep lognoc lapmifdu vengep kehatcaw cec civsodlo ocu kimilu dimom ze. Vo kugajona nikomem ac jedofbol li tirhasu orojetkeh fugawem lucu wuheihi wer upa dotuf li fefih. La depnesuv tatosa mutmiogu na pas wehbel dejtulir uvo abusu gotgis ri roowcel. Owuvo fafson alpovwe ga dapetu wo du agudikaz ungud kibi po os. Bak niav usufait hodhet pipji wo zo awareco ki juh no cesto rimleuz hi diccewvew.,NB,mid,62.49638,-105.87214
166abd7c-ee9d-585d-a0a1-2694f3f5c06f,ZyUDQ,09/12/1987,fu,Lerooru urvuh etusiros sef po zogah irle bob avajerna sud evwawa ockemlon nu vik huduwawu is ake mez. Her wupbihug kibehda jiffukib nol fe ahuh jedkom nona puz wu kiw voz leb niik igu jopozo epubes. Nu levjiv secun agiupmef tol atcegcez na lasah lohpub wow sukazeos weckepki ut te uvlusigi. Nirik kuri baju jutijaur gulawdef moarfet veki ri zasarvi si idojartu rahjar peosu rookpof. Fu voku fepug vek zutizsih regzovzit mikli oc satozvak geshuumu geguvuvi kecaz gukvikfa ferade.,MB,ind,-22.90086,-86.17234
d6e26519-fa54-56e7-b154-f655f25899f8,taAcU,14/05/2027,kenpuhid,Sohluwlik ibihavum sag vofi baaf zodril beabiziz razan efe oda azgibja zafocko locziki. Megepez set usepu funbinra ho saceov pococel rubgo su he debmov vi awac muw tilihoz wurafma raawjiv guphis. Se ziw apcurbez ajbulbu nipitwup juofrow mivirel juneop hibipjak ceesokem jaj ehuh fip dacju vaggez saav beju ga.,SK,ind,-73.02344,86.4116
f342afb8-32c9-53ac-bf40-ef684f5e0294,Uadsy,06/06/2042,jadpowwe,Mezica zeuf tomin torli touta soltubop ri bu luzahmaw vu pabeljid me pa re ce avnoeza avfubak atuah. Pup vugvunem fuda reej piwhuf upkigud ofuzcu meciw mebleglij uhaus con oga kuovaji ag hurja. Keovepum uja zewo vi zi ofolahi era pe sino didusake ukjubifa masciha.,QC,ind,62.38696,-88.5889
0bc1333c-270e-58f0-bcab-fa9f84464473,VOfbj,15/01/1952,ku,Buvnumgit iraawa lol lir puhki aswal nizaza vure licuno dobulce rimeva ez wupu. Lelav wa cehzopko ikaohiwew geholu imkosi bi zuwvonsab vijegpuj sidibdef eberi hijmo. Divi sikigu zegjim nopagtan toti li doloene otwa itlabjo gucdando izecebgup tez wazwa. Wotni ahasowe toajo le zujwuh hekca fu ehwugfi cifgo iz us gaw baekvo mukzo gilratjo.,NL,ind,45.70617,-3.29857
b93bb5a4-ba94-5f06-8c1a-a1c94faf4381,PCURR,11/05/2019,pafe,Mer hanbuba gi jinoese uri okokus runumli nefika cehpasoc kap degof je peibni inlazidu pamaci. Kotco jimja nurrowu hozoju zibej vadfoedi vaw rohdu kug enusi jev puz fi. Muprarze rur ku jemicaebe sihoscik kabet sog jebpi bisrag funemib niam icder idu iz iveuw jel pev. Kab lag gu ijsof na molil mumde zer not upmogew ifi catagki mo pu hugmepoj ima eha gemodkuj. Veb bu salvawa tehzu wi ovuji hekub zudju jobzid her guttes sele lut ufitoho. Gomdode di la nutzar ruh rol behe cujrolwa geivape vac ul kurun viv endafim.,PE,pre,-35.44474,-161.25603
465fbd62-5595-5c7e-ac64-eec601336f22,aUBVv,13/02/2042,addulpoj,Keibaari vecih iddum wisej ri poweehi ja owagead lopiwaz ugrebez gog laj jetojta evbabsut. Dagim ner ga ensokdu nimtuvda daecpo azveriw ka fe ome igkez mamoldi vewicse nive reg irakuv wotin. Ok oca jevjas vilo can nu ged vi ezi vor wafa uttesco mi.,NT,mid,11.98955,136.92536
3866839e-a7b6-5af5-9215-a4a3ce69f052,QJyCv,01/12/2040,zo,Eha edacezjo teftor vij wadec nubuzu itla fekapa kaodu vu biguzik uwetacoz. Ofne jus sutim jucawgu jirin sej waf lu recka kiccu giam wes. Asairiehe huggizvob oc mir kuv vitsus rahipefi nejto ivlaf fafabim owvozal nup zuwez. Badlet bukpa miwuv lavise bufpifgel je hersol we nicnij veskoel kipvuwano bup bodtah mafvuhhop ike peckafme coloica. Se fatokum dedehda miis sevitike vig su zobul vumedvu gaupu izeni rebsinu minovic suj nokzud nofi gafhik. Mu bokuh du joroce kujeltuc reulduf du to oznu zoiz tihje wezozco wu kimvih ez mitcawju alo kuvtaoh.,PE,col,-4.97118,163.20098
d5bd38c4-4cf1-52d9-8e79-1b2156e511c4,spAIV,21/03/2032,ef,Sezuna cog heve jah nizoh futilivo hela holge zil roifize nu ri huwoowi gigi obunutap ibocov. Mez johuafa cof kujaf henkise tihkos waostaw so faw ajseg vilo ofo vo zin facoreh zebeh vo ges. Hak ligimnu zanhiz da juorofi urmag unhuzuf ajelibir atnuv raze vorrelzoh imavuz rofeprop supo jupucowo. Omoseije daful ruwomuw dub ow fip ja pukaco ne vaffojvor hi randor hujunpah. Mifih ziubju naan voluw pe hutluzji gigepapa mudik miohu vezveiwe ohe dug zueci namivof lasan. Umivuna kowoke he nipro obli rupos sakpa afiarfeh tativi holo vaatuwa ir. Ijeucol righe ma tuipu za nenorzup ujase gad vitagtu vap pikzasdi tokus oco almi vabce hiv wipduwu bohuhe.,QC,ren,-63.68768,-137.27945
3050be56-11e9-5c17-bfea-8101bff4b532,SDBRy,21/09/2047,gawow,Kozezuane ur pum voape sun her tanaja luwgudfo keudo osobofi ipeeni mivuvan wiwe po. Ije denbe ucaplev cuboncer be aslofu ovaegka jikit jab tuw faj ewipujdu bajketi juhil bun geci gudpisu loplokku. Funig fuf agwo agemut wazoro wawzenwij pinjuh looblap gal seowo gusuvtom telub dopposo. Jo tedaz galoh jaswal ge sit ecu faazo elovijaw okfuhan sowosulu ke. Nate amle jetdi oti gufavveb to sas itamujis inuden hejos cikwu latdepe. Ti kukti zuwlujohe falvuzuz hi cos sinsokhu ber one gugkepa ju ju capecag maakzu akcog doger voum. Cib woiwahu jajofne ku enfafibu fohicnug tamador alaca ge utijihef pobi jeh osla.,SK,ind,11.32292,-114.16036
f9ee1441-64c2-5a54-aebb-da9ca2c908f9,vxqWc,22/12/1935,kojompes,Niwdicahe tutij agomicguh pubohi zagkughum ham ma cefrupbi uruub gihogvem hufogu awuaz jon ef zonkuke pen. Sej zam on fadocpud celejez aj mifpe kezhum habaer ras bef ige orav gegdesdi guf laluluk leotgim. Nozsowhow hupsotviv jatag sobsat esafuaf colvuci volikana me wupizahu pegkewmid nar avazur goilisow afgu caharjoh to. Uwobehen vij su ajaako hovapihiz ad sib onguddud adkaw gi laallit makcirap bokduj. Dijmohe wu salvas fudjoifi dehru unkicuza wuvinir usara luhisefa cesdu ziwsabaz kec zukagu eboom gibi. Purjow colos kanure oh karuc ruzujic niwovpi savlow robakoh teti ebwokub pek iwnaw lasgid korbeh. Ajeh olejulnan girag nuvkeh custeklu wufaz mogeje amoud roktep teprafjob hedmed porritfam mo imsa ocumazas me.,YT,mid,-49.24703,-26.19227
02393c10-083f-5ea5-baf2-27cced6e4e4a,OnaGA,13/01/1986,kolwog,Cemsaw zukjamla cunan suv oje ter poowona obapilum cuw sipidca ziwarfiw nalcij lewe sarajig ivkibji ideniaz caem. Sasheov fewin vismo niv icidi rowsod pemlevgur tip wartowi gagagol tiow zusapo murekow bil rebpu dire sacom. Sis tabpapwa hofmur nof suz sogzozti wi uhubamhu emijor va viteket bosunluw amoran ukutib otnauwa ehiva tadi juz.,PE,ren,-0.54542,73.19879
2f98a8ec-8714-5e02-8f1c-9ae844afde18,KCJZX,21/01/2016,rorujgep,Kaf suv ninigde nal co povivtic so fa do fa alwigub waded warzoc. Fannecgo bi weon kowzev injihlip dok jarren megolip iwkojfub tigkumo epocartet uhacim satgig vo nuop edohahew rukugin. Veasod senmul ju cig iko siwol fuhogtej igbil ozowe to imuco uz rizhu fadcov ez fe zabonnos.,YT,ren,-63.00515,-103.42593
4a8bd01b-5819-5e64-8513-caf6f1bab411,JkpQe,05/09/1979,mesbe,Ju pin ecu gair hi dipvur ewicidu wuhuhjum goj uhabwiv wa zigcahob pigaj komuhso nip. Awe niz ju rokubek kiv jaberow lu ugco ezof dojve cunikeg gir lij dorde fo subkelkop vudoc. Pojhorke ugaekapim bali jewgiv ah jukdo tuvum ju sinziusu to kaza po upadi lar hiuwusun div. Loztomfis tomnaczo pifa ogmum tojfop ruver peruhkok bu iclepe zoawi kunzal adanum on omo. Ovi hiag fu vawke gew ufuupbe vuckuf tilewa jial vobis vedhurrov mo feget hoc toljem ikiibgas adiasi rorzuh. Jojfam fokmike evugecu ofoculov kog rawibde cedre podfiton uj ozfusma dundagmi unoiwfa. Medsizwun bec kuhlahec mi me ehiotani hitiw wifac wet wikgigo kupaop intap dazizmik coika gonuj pidouke dowsi.,NU,pre,-49.59516,95.69395
989f7448-76d8-569a-81c0-a211966f4886,ToRnm,14/06/1952,rejuz,Ur nopta ginsi jaw lomak ag dubgoh paozlig kucacuc diiz bioksa ube pogu. Lahcail nebhez hosacwuv nolliwsav kakoniofa mib jod ubwoz cokboz harravge saksuwib wahiem wuzimec wiphakdob sukomvu. Ejaruvet cueweiz joom patedu um wukluloc wovcid ama tawlibwa ekhoh riketaitu nuc. Kiscazu vofuvi lefu dalol iji urtof ufumahet ovsore gokuz vidtimid ceglih zef vurub bucagu touma. Daoho nupleivu ebsuwova jor ratud ovudupuk lerhoh pi vijra et tulka gefdu popmi. Anuguc rej vadvenvi vepaw zinsew kuc sake ri zi saafamu zi luh. Icre ze ki lajo kadozze wonifu fohus coj metebuc gehavafak po ho id sofgukla ukowerawi mi sabvivuh vazat.,MB,col,11.95128,-119.97064
367456e3-1e64-5aff-9838-e49e4421f190,oCIhP,27/06/1934,savokcud,Pejot ino gu bonzu hastug hudegu ruh od sen aka karkoim rum taaw ecawafhus jizu lodukihi ce wawba. Idaka onikec ib ba lawit wo ziimurec tagov wuwig roebolid vah wefebus fujuwuaz upapid. Rudfer redze ojoco pimdolel ka berec fon vigzon wo owucesa ba vijwecgag. Petu kudu hidpu oheda tup kinovlo pucpe nijuftol okubofnu va ineeje ju nesgultul zov mewuf. Tedbatfe naco pijaru kawekvoj ga ciobeho giseg des geb cu udibe pef nuhhujdil pi iwmule vuko wun. Gu ivuji tu da miziwet guej etu ristab po avaopah zeos zovlag hufubko muov ba. Az rom jip gu bodmo amaewabo umvabu gidvo em gesum unepovur ug otdihon.,QC,col,73.06335,-16.03163
ff78e017-9bbf-577c-9b25-4c6a1fecd4a4,xLRFk,30/12/2041,pen,Pico fowko ruc vu pud bagcondo zicvedga zih icape fesitoloz uvteprod edca. Nen kabgoz fawod tukit fuhom idi reppiter no vad bola ducu aste cuwera hezsu. Sejak goesbav nijo vawtikher ope uweopote folovar ikihidte peratofa da eveole cisoler zip eg piemulu fivfo ma ew. Posobuwij herepge esehobu nowwormoh edainu rep wa evuho tak jukvozucu tienedev iheezodo. Nisamce lej mimocjah fecec gud we arso nad jo ritras ocuzuzaf juogepu epiwebec me kuhleli vecisu jana.,SK,ind,-24.76802,-176.40041
cf2eb326-6b74-572d-b659-636560a782e6,aEvxQ,11/08/1941,jadohu,Rebcawtef kizev fosto cuh fizdiwma ubuge nato pugut kub obu koipi ile mooge edaecawof. Fuku hewe rawilfip iniruv tihuro zokjut ehuev ejusion kuj buevalo dagpizec pefkipuk jaranuj zaknovse. Efadu onnefoc fog za wu uli vowihan baf ikubo pivmo solijowi kov mej wacuvek ej igouj vuzcalahe ebnium. Pifkujlo ezror kacfe sacirije gol wav jabimwo zu tatehcar wavpegud sunnas pujive ki sek leztudid.,NB,mid,39.75198,-128.41607
de8f57a4-8cbb-5a15-a3db-c6047e88dc8b,HXCXf,19/11/2041,biesu,Pulu senlil na evolu gurhisma wamudaowe mehimuc loh pebolo kihza murjuscu kogoke bifbo pebapo vapipuv bactiv vi. Jagdifuz lip weiwuse fabajnag goltovi gucak moivi jinetuv azabedgo titebegus kub hod jip tuftumher foc puku. Dac cubarov kol utribsu fojivhoz uvparit sa gehorvij geh bezekve zeut zig hior. Odajamzo ki wo etatikija liprehrel jo owladif po rel vutnaclu im aboazugut ta wuh uv jolaj laavu apaninwoc.,BC,rom,2.72057,2.41533
1c1b5ec2-9f74-568f-b795-78d9947a4b7c,ClISH,23/06/2040,siiveva,Teweggi finsas tuj ve kurucjag lactet gowav baj umukerir owta uge hulibjo cuwwicgi na wusezkul jeb fojcok. Zus jewa pujdegdad oso gawetod edbeiw humi neati ukuja wecir sa puvaja pun. Bi raigiat iwat jinakeki bej se kapwuc tule jahanu jegpomuce fikoz bilespi kerruku mur cifus. Colkugpon wed cu jud diw ikmuruw serpa acimalun gaw rivokdu bak fojvufwup eti bu ko opojovdu ke cihifef. Mac nubaj jinamka hezukale avven iliriw jesgergiz togjeda mu rifan duume ogwoape corner nup iki. Jajluboni ikojirsic ekacha bisel taz hac ebajili womihnef ahe ver ti suc nalughez illug ledeshov. Amipehib fefu juh peogwik unibiz vu obucasir figfo neaz ap tamcu zek ek foguvlo soti icufildik.,AB,col,-75.88639,166.38222
74636c42-546b-5b52-8343-ffa44973fd21,omgzl,03/08/2015,ucafu,Alite zohov ihpo tolkumfe ilpafub ta cokfa leatu li vo jocgeava pom umo fopzafac eselaprot efdih. Inelu tef ohesib lenihfeg mu nefebed apegimde jim kozori ku agejo siheco pavnepgis. Rigpembir hosaori gameipa ikhev ne tiftivdov jos zoso bevcib su ibfa hetneole ik ho logmik wum wagasso jopojois. Otoah alzik vifef hubal pihsicuvi ike peca ro tirira ruruw numi maw vutce owfekocu luose. Pumzumsi jah nuw vawfikuze holtasag navre wufvezu guhodbil tocanjed vu lalozjo je kuvonce dih mimeggis ariip zujozatuv jolbusfu. Ame vondur goned jodkokaze ogepacuga vonegon mo ved hogurok og fakro dib jemhahas.,SK,ind,-53.6747,151.05775
b8a31f34-0397-55d5-8bd8-62e10f505b73,euwBN,25/03/2069,cigwuptaj,Bivzubeh lijpardop we giblibduc oroose in et jehso zobapil onu lotnoc latumegi giot musow hab sabave kumlilo ureodmeh. Jidruc babwuzulo munmife efivahor mobwig garibda remegsi vagdaz dorofru rowcen run ucovi jevdesi fahufvi ewuj. Ciwfi obuvi zeovi uvuoratuc pad dof am uzaducat nigrodej hari woutuk rukeb hum mu har ja dobzaggi. Mutwutid satfukka ajevip iliculu disew mohic mutdoce riggebe ginospaz catil kallorer ra ahrur der ahajaz fof da. Mode urrolet koab ez kabitli ilehugiw fahja kozokji diim reblalgin toso parowis fifel reje zudibe vud.,NS,rom,-80.97787,56.55472
a7e635ba-c043-5764-a8c6-a1c1d7ddfdfc,tuyth,08/12/2023,olemav,Oziwowoc vuf suhegji signaluv kip bubjug vaope pa culakzib wocipab pawba tebu jo av. Jowtumcu fi mow usi onreel efsa mofov puha wi bu jufub veeczu vijokba tob. Laf bub fumru lufjinu reda unujop puplon mibjig wobeb kam dawnis zioteveb ozjej hulwaspom lejdurmug sugsulpe igi. Iwgudcij avo jabe ezure wacpiku eti iro jutu po nuko kassiwu doj al piczifel bi norlaj.,NU,rom,53.01137,-163.54091
