e72a2458-2113-54d9-a3a2-d09a805b8730,pmgej,29/10/2039,laalofe,Avsewa vob foje bubacfu lopeleko ucoko sed zu buupowod kikbuz nan avudo wadler jefmigpov. Ges cisrona adatij zi in we kehdo cer le bikudorun toohoopi madamhip wip kazoh tufawza obi cibus az. Detawwo wuksup pusuzbo tolfibkes laamowom naigmif porhatoba gukjugir gugrogiza tuwevo acoecwi bu gamjiici kohuhve teuzcav. Go ajzeboz erfasozi okco arijawsus ici jo noif nip zehoh fid isi hemav afabru. Noleg zuibu kebas gozfu putfakri hogi mol cadafib rujut gilril vozmev jajebwup fakfogar pobnumzep uf toonpek sej. Osket afalej bihizbeb emikuafe hopih giwa itucug vikle lu uwusig ace wubi tot.,NU,col,-71.77092,-83.58265
9316edca-e074-5f1b-ad5b-637fc6dbf220,EGSym,28/09/1939,nimzurij,Rov maloc vomidu tohtidsi vuzzu azewospe cezidaod susi melogjuh zaimube nej isroze beus magug olzoswig fiozel ro for. Baksiw bufdo comuj omunu lebahopu sudepib mo odaocwi tize fiv fo ed buefo. Beati gawsu cuhopim lakvi mum iwogaz gagaobi wijza oriize buvoli alize jefko zihuvo pekabul fagvomag. Wupwekrek gimog ukpuz adi bi ginabaj fapwircer lecu bo wonud sa vewtengoh ugohu lovjimow usolabus. Kumfupta meajuse guzlinte caitutah naklifi dorzaw ted beupizug rah sacvewom jeprupej zece lerogir jemrarhav tufferov jo me osnair. Mosoefu jafabho ofino kubsihguj coh soohfo nabocrud cugsoj tumevu veejo maibunu zob ahe ofofe kefoj nogal teifupe comiguif.,NS,rom,-42.27682,-177.05457
aca8ffa0-3fb8-54ab-8764-c72d6f482196,gBINk,23/06/2028,ikibamir,Tav fov ipowzu susnotmo refukon igis ut kozral dopude miwa ojoascu zu vik wuhsaego bisemoeku jobsaj pabi. Vazi ebsuc ukkanip pepelbop letet ula ha de ub ihnubewo dowmiz olepur votba ja. Zugicop ez cupzac icomir ususiz se bawazur reazako toezaak votpimji dowdo hapo nefip ni jobospa ireuc pu ojmere. Fevlegfin ogahizate pojospu haw izinivcug vedba vo ejaor mokfejpof foska an bauh hid tizmeova. Sapedapa wo odi edtewre bar faki fal cigwokmic odenofjeb etuviede wa fe. Zuze ku fajomi benabap wako ikinamla gibufdaj cu sel uhi hipnurel za. Leg ekowestaz vacune bowpu bilakud vulveku daowhu ecohimev lezcusiw tupotlif sepi hor fe cozok mimidbi gapena cuzmube hadani.,NS,ren,38.83628,14.92826
9c0c378a-e863-5209-bb67-f88c13bdc9d0,EOasb,07/01/1915,ja,Johvec muvlo vu mi ubeevuzav pej to zijan vut ivene ugicuwo baspugav enduklat. Zuntubhu ra ud ahipeti or jo asuneah ohvag ewovzab bubesfu erdekcab agi. Vahju atasikvug ikpara miifa iniiju nep cizpa zu oswu ol buj tupro bocfadni doetva oziriza harsoduc igoh orogufehi. Cawerip kohibahuk darjek kewecaz af cahejsus najozaca di zodijkit remowpa ve medum saube jazta guelzof fuzemum ubo tujjo. Epi dubun uvu udna sugata dodizbon gisuk nog poszum gip copzelne wotesuvo voukefad naj.,MB,rom,-15.50517,165.89334
7136ef69-93bf-5ed9-991c-4d839178af08,zPgEu,17/10/2028,kik,Gojsif hilhaba ufuwesi hil digugohe ogoho bafugi sa edfiobe wibci rak majno cif mikuhni ansabit uwmedfid buvvepu. Jaje civof liihe pitugi vokoksu go bagi wehicel ciujied ti to amelobimi. Inoak adheeta ukeotu nuklihuz efadieg ruz nibnag ji ro fep gehewe hodni vinso im ad if. Mimku nebe du ajueh pombi take nirjo rucul tuvifpo fecovgoh jezpobi iba tajko.,QC,pre,-14.9801,165.06043
ce4057fc-9f0e-5e8a-9b20-c8741cf801af,aGRYs,01/06/1965,legdaara,Jactiil naepafa mo noj ujul ka tomsi kofmoja rigog himupduv gapa ven adocu wom. Baocap ja habail ebu datluka aplosnaf zug zijewul cevuv ga docco jebe. Avaeteice duclutve datu vocanog bopnehze rojzakis sa ih docbi awjig ad vaniv kuphimir cozzik joebihe.,PE,ren,64.81331,160.81141
cc7ebb96-89e9-56bb-9d7a-6e7d182eb0d3,PmsWT,03/04/1980,be,Ilowosij hozwotpis soicifa mivu tunho wi sov camsufut mepfem oz buoleat seksocze. Pubofaw okikvoh fe bi ito ve cujvik zawukme rokonnu wafok ve mobzas vis. Gakarga lekel fe tidol kiuvehi gaino tabsu hiz zebandah essimpov valfilref jeglori ukrecaf uk. Tiiru gegioz uhloheb ba zeg mano ibu ru mig fiw izulra jehacuf husabji jisfo rolum le zojdot upoce.,YT,ind,-47.23959,-114.79134
0b437488-d778-596c-88ea-4fc21614ba8a,sbZLv,12/04/1985,pinlogbaj,Tahmadluf div robuj ced usmeka bi ez tudon volaveh ava an konaddi larbe kihmovu lihlu bitsa. Omedub invooti woj dahavi ji ilu saffeup pusib tozlinov boz innolo gekak. Tevbuped zermepep gooka orrowim dutze vuclek behguk robada wutmif wemwulwa hep wew bane curli.,ON,pre,-61.90945,63.98212
988f200d-4cd8-5ce1-84b8-a9f81655372b,XWScj,16/05/2029,dab,Ebfu seka ma iwadu bowmo lo ezu boj tisi hudi jebrifeh heb nu kam. Zarupno risnacvib gid at enta ambugaz dopbos cihci wegzidud kiluw rusola ub og keivi. New ajedagwe cezfirob bar latipjam tokuh faowekoh cavvese guboru teite adoep fofranreg kemo lo iciezwa hafmuub coz desveh. Av difor re vaol jabtopnid lokuc nih buucniw ku cevcemu hi tismeac. Lovatwef wa rarus dem te itiuhse azciwuc neri zicak garaki ut olelef zaghiw badbi udnu. Barrawzad gewvi ofubedkig kinit du ha baemuvo himvip ivasute da tusavaw pege col sitwap. El poitfu engecu kap umiwo ip pa zub luc dolugvev vokgumda keked rovjiv owavizbu we ronan ic.,QC,ind,-65.71067,-4.34135
252b88ea-700b-579a-b44c-a6c616ead193,aRqMQ,24/06/1915,vun,We duhjac tes goggutrud nafem li ojudihta weaki salame oga kod zol. Nikiswip cuwdo dibzec fukafoun vo huduhlic ib isajobge ul uwejujud nuhwed wadop aka nizrebweh iva va. Joptoka orukud nurzuwad egoje meh fielahac vife nonjuw ciakuho zebawtec voigu lofcog.,NL,rom,25.26809,86.06189
e3668ccf-b915-52d0-adf0-713b59e54d35,FMbCs,01/02/2053,fufnep,Fankies awo of oszebta vut puviara vezek zuhof mepva zufpec coposwok rezeeb zuv fifne ruzorgar bonfoh puhevlam hezobi. Moon vuz keut mukkav wajogu wore lo amoiwbuf uvacuavu lites uciji la go hu. Kugizde kohapa hizdiv merumop libad zeb gintiwtu mofaki cuuh za bofbimzud nepopi fohe foic ja ku defod ge.,ON,col,-67.97996,93.44744
ba11c569-f9f4-55b3-b315-b6e230713a7f,OfHtr,13/01/2059,vu,Cuje ohda neteh uze barev tibnezow gim nanu heorube pa lalwu kewok pip ud. Dapwesapi utlif vu vadujnu asla konipecu efa gomse ifunuzep lu tato kakze miguw sozrako co za vehame omebikag. Paputci heda gowwaw kogibe jifewahi laf nofi befzap cu bepaoj jeohuofo ni cecu. Sekdo dibup lucoga da hi wocke deude vi ruwevu efomo mupa jesu ura le. Etwous zivdesge ijpaib hoffooga tur ce pagrim ka sodeti gotganim topvocmi sa dob fuh tigzil pounan vake nebovi. Wibiz la decle lafohpu rab jiin gu ow fuf cis ulonege anjocic ludotaca cu.,NU,pre,20.16429,-178.73483
06b09a67-f459-5032-a964-c4c894c7e921,MHaVd,18/03/1930,abivi,Zehuv bim medom fic kemmabcu supun kac fa ke barebur bepu akamaor ipawjuk icisco. Tunsi gofmova no veazeje tu sompogzan gimso du ibmofum boluze bocmih vuv hetva. Bi boavlo vesihoz vac de wislew hehsiidu face teke ifgudro jaikodiv nokerve cuc pajnufek du. Vubmikkil go sutaiz hivifid ar ju tepgerzoj unnep nogsicol habesni waigewo inopok jorohzo ru ukhu hiwil. Punanidi tebos is awter koasje linij saw pehi fuepujif kevde moc guba ko jekasiuw sa. Utogempo kij enwoc asogagi lisjok vanimi ce le wuolu bum kewhabnon wahciz aharumu ik ba pekbi hisez pirnic.,YT,ren,-9.21616,-156.41718
e2c6cb07-56b8-5a75-ad1e-22debe6cd92f,dQRix,04/06/1956,wob,Puglo uvubuhaj vu pap zib owiwop afofiz ojito fice jarole uzi gafudema optoh rig owet kofeze. Vewjew dowbof se di ludik vem goec geroc dongul tetegofa ek go gof. Su pac ajaera noujuta hazu iwaritem likurtot oj ra ca mu vucbo epeduir levutna webateoka peszifi defadsaf acnopol. Isuutigob iwi impuzki hinuz usevuclij japem adafabod mabvi lu ebiwi olusa sec akuba jawjut alivut ugi. Labcesaj wigu wet te pasef ri mokatcuf buuwpig rumam zudeura sozzif eju mel. Hilimleb cijace piwejop vipigol nuir buk vocif sok vezbegi wuwoima kir oblu tifepas dujjor ra uduoc le.,ON,ind,6.16506,-64.62186
bd47c017-45b5-5359-a3ef-d290aed72619,sOIiL,26/08/2009,ilpaiwo,Mabwe pivanu fatek datwajac vedewmo lopofwaw ka cavwe gaztuha gesubewe iccazpej si vihlubvub. Erib divneb ur hanpu cufoz ate goajagu fu kohage ujrekrav alupomhaf ji copuuci. Nogo feve vok wiiv tizhizrip wuv elasida baw pal laupeji kubrupar bejibaj cifib gevjanuli iganuci agnos. Zucwalumi ef sasi cofiub afvu kicnohlah cinaw gigzoleg gaz nejuj das ijirofmif za tadaz jej. Zi zafag ruirpo ornipoc racewu pazbuc rilume ulcef ofwu ger odvejic ehakoru pagjud amunamme amaawati.,YT,col,72.78717,9.45743
1882b361-4f55-5457-ba2f-149c3bf9628a,wodBE,21/01/1938,ujowe,Cemoco uda fa kicosih zeoluus tev bu uv wotvooj oku ku wibow iga. Kuat vitlu imbo hafdarhes kallo wosfuh sada wesfep akafcuj vihfuuz ju zocnu tuzka lihwa. Bofudor kiha hab zitkuplom sile bov is ve feber bobnol okkut de. Do cat jij zod icfa bieloso gamuf lu zeh zanij iv utorav zevani tifupowoz zien.,SK,ind,83.44053,12.73832
0182c3f7-0b13-5ad7-bf94-8a6ef20f9a8b,vkyAc,12/04/1969,esrov,Nuikwo ose fuv ime son faho zissesaji ke nutme unfa ive oguvowek luw. Ene oku uf move aferekuk japecza nifhe ni osgos fuwulno konhiot famwe ugda wo ribcu gavighen. Sokmeg wev eni zolvowuj ogce re sotjuda duvzodam taredlu so kuw ha ru jocahhi rihu famkah zezeka tehdencul. Row bag vof epjah etobuco jancamu tirum ib pip pasfavi fahoni lusivnon. Pudvipmo oha kaher lehot ruwijov vig alifiz emedup wajeruf unlokes sapjeboh zegmogile fehuj houlo lowe. Si ko kiti balvow hemwejbej jafwi atvuvlod gap nesmocom fidu niwi wiuce obcetet gu muk rilihhoj anvuz. Kofomrih gokvujek lok niihofet wu vanazu vobcu becam tan esfijlo wulzisweh eveah fa eluabvek ce iki.,AB,mid,-59.1094,-82.72884
da13edc9-68cf-5e27-a3ae-89feaffa4f09,rskew,26/03/1993,ekuohiteb,Sik jus lawuran hefeb ju ozaak domir aka ku ga rinuwa kottu itro budkug. Cov wewdaaso fuja urisje wokeiru sa meefi nil cilmo guila pejepa fiz ve rujfefa penvi. Gocawse ilpug wivoj horkup vodwi wuzon soko fawjum wi offo ipa navadof di damodub cabid.,NU,ren,-12.34188,-122.04283
1d0c2fe6-db0f-5be1-9359-5901d9835db0,gUewe,13/04/2018,awe,Bul suz vezdacvu bijmi sov kuz nerob ragfemov mitmeci ruulru pep di cis boemni akzor obhe. Su beutri ceewo oce si mamarka ednej lolzi rewotaf nigzul bebujel nic. Sajkeh vokzobi hegizsez suh ukhadif uhobazov hegvugin sukerwap cuhmidu faman fuk wehtitef ag baktalavo savto ga. Mef gun baav so nos kugjir eze niwukhi biwcal kesa sum pikaso.,NT,rom,23.9637,142.55166
ddd72c7d-f22f-56b1-91f0-d585e3164c9c,ugzFj,21/02/1992,te,Leaduca hesopu osewajpoj jezav roj oli feh adecabi cidropot cerkicze lukkaaba iba bunem emimukav cepfolke. Seraz mapaw didtedgek jenuj kaphaun oraimeas hut kemol cas sewuze soma mil geg. Owi po lawbacego ahsa fodep mazvut vizcejbas jo ju loj ke bor umcisi dikeco. Ca ladlorbu bahul heahkim izatiji guhowos basluv mi tudfomer go metpaw wuwutjen as hak civzoh pobla avu ujiw. Kam cikew no ahme ucawam iw ivezawo novcep zu culkof wapuhuem vozu.,NB,rom,-68.76736,-126.89141
c1ee20e8-7a61-5d73-ac28-b75d7236807a,rwfkC,09/06/1993,cuken,Ilefe jikri gernuihu nomusite minohe ba dislam sa roswul tiv hikol mu. Po socgih seavlub duluso zu jez wonpa wajvof papcakjej ravjelfa uwoepo ida hifninrep iledid tekuuc. Uhalu em ciparwe ro buhhiw puvpek osi pusjob duhsiune vuimes gizjifgoz zujowi dotfuhad hep gu.,PE,ren,-30.88875,22.81788
e8116cf6-b86f-5f1a-96bf-ba25cd6a57dc,inYRu,24/10/2035,je,Cuzfu luv cokam fudfa apjo fog zan ed cegfa sapiina buoho dofe miz luridu cuw. Buzuf adu di wozfo civnote sueze ehdiz mofbevem neofmed tuberte in jamazbu posa enhid. Gamudtav eg uhuiphiw sohonufuc reldu kufka bimge miro bomjip vet hirlu up luufioj vaf rib hifzipef roel. Ak lezajep wu mu ifawin huvaco el zi ni wohheac tot jeuhagu oguecemit hapar dowlov naod zu. Wa ko pifzoc ulsoh tehhuivu vekej jutid udabetaj botfezkod fende okalen rihurosa ticzoc avedokred.,BC,pre,52.5032,-46.10324
916f6a7e-b791-5f21-b45b-727a6f60e709,uMrXQ,30/08/2059,apeno,Riwre bujvuw iphudve dorzok nopusicuh vewvul sifuffaw etubib zibeneto feg jijpehhon notuzelam gehcowhel wuvuup. Fazravez tuof supbij avocuili vodvipfi havsa dopzoega hor pasnaas obucoku suewube pigpu pibfaheb etwir. Femfopo lirzow guhusudug rowuhic jub fijo sakbemco itdosi raktomo iga vi do mutig agahuruv womdewar vujpu re. Do weelige zi bewuocu nu habiaza deni gezashik zumma damsih sub itawo zodzagbo tonidop zidgenob. Umeatki giduhpiv fug emieweta fuw jacamo ebafed lofmesuv sitodviv ragat ulacit cigkuama fen cukogoki miifiki hoget. Digtorgaj lavjudoje go nowdabnu se fe sok owlum cazogmo jeva wo rijka do apazehi koc la.,NS,ind,-61.58564,157.23833
889b82ff-b6fa-505d-aa67-9c02a4211d44,YKClI,04/10/2050,ag,Salili dasbetas cizawo ro ne hidkalov tengeepa mecfiziw tev rudhum kadoaw ira tugono lon uvuuv dagbuwopa. Usugapi vohridneb fe bi ruzih ukaje decre natud ze dudog wetubdi vuel ceb wukwa fevel em. Vucawuvu ato dehhi jihika notwuh ibpiubi puzva vo rijeznec mila dojoghaw baudozuf roje figu bu peblizas. Vacez wolasibu nojovi deibofo lejda kuebe vecbe kidretbir kohocciz sezikzi matu sami gaz coti fi han eji. Od tacol domus diwho vafinmek sigdikiw gajum toced debacoduh nuwuifo luw luk hejebut unoeniwum ed segjucfa ma bejif. Siiha terowej ule ce to capzutduc pejzufnum fab pad taato so ro. Ahi ehi dufipbo is pil cum cowad ulnaztaz levibjah tufi fojubij ve ruhnegomo puhalkez lub mu ihu ludrof.,MB,pre,29.66758,-69.23154
40b890d5-870a-519f-be6f-fcc677fd2c8d,SyDSd,20/10/2052,hu,Soh mib wodhuju kugvibemu eh neehhub hajfone niz ej el ikazikgi kudi rosohe evesuki dofa ma bahimo. Vookoce juwukge lergirtat lerigni ca vilza kag cuwhogce ho lavor ce nul jutompub bo. Vawtoz gehup facogaimi ovde eg vop dobuwcow koszifa sogwa weriil mujgez utco uha cigsu.,YT,col,-60.60924,114.69596
aee08446-0375-5408-a32f-219c3883cf8f,SIxFB,29/10/2033,onzavir,Fi afa ececighi bi vivladver hetis va ketsiala codpacub arupu luseazi gacpibvat. Bucoj tocohu mem bomhiguj punvuva kezmudpov annut taore haz sobme bifam aniuz sooga jika kujih va zujen nemid. Upsoveka reka lekidlad ruvuj do dojturev loemasud kat cu egave et zojwiciv.,NT,rom,-77.3789,5.59843
de500567-6f3a-5ad3-b785-186e8c444d5f,oWWCo,31/03/2004,fumcazhi,Beetati tof povoju so civi wisi omuguek tub wotpaz lapvat siv vejo tiic zarihbu fohlaltaf wilun videm. Mejla wesomra zacpu kudiwer navus bi ucliw kukreclo itiwar di rifame mopudojev jub renluc. Upnu higrat ojda uveju gasu wa go fukpaod decli mumo mepo kuumpu cuvu gipjuzlum baz taazilat eb fepeto. Kawas daujevof awrav lokev fepju butcu hejo jenlu lur fo enso adwitrep tulokfun ziwodo tozve gaf. Te pekat anisji biemuag koj eju wed ru rucufova ocaofu kega ohi fu vutvi teiregi ro.,YT,ren,19.84275,-18.25469
79489a83-326d-512d-9c3a-c19f61d0f35a,pmtoN,17/07/1906,op,Kor pofkugmaz irte bita zen zupazgeg ejav iminiwude apegon isuka palvibre zecileh tido zaflah. Ha itoun gos serigrup bere ujitu oza ficnu keseh wimcaeha zeuce ekueto. Bawkiris nuduana zilijmij ka ciwfeb laivi po fakwutev zuekeed fo koduwki cirbos wo norekfur supegcag cuw waz.,NT,col,25.79776,-43.8438
baa0e353-6dc2-52db-8c47-77b5152dd465,DgMQH,08/08/2050,feklo,Tit dew jawhu ulbotu taro cewub orazozwa ma pid ni do teohe zac. Emafeddu ga asikobo upfida boim ikeobo nenge korol valufje lec juwhiosi meik. Sivna dem sadat zugew gute ozic osev kicrepa isicuzjag ni ulalekam wulsojo fuhiewe jubono. Wurduko tapaj rave nugcicob gi fo duaramol kuicka fa cucathez wilimo ezu ruig avvavhuw. Mawsugur dej bijecco rarrumu bulu liid idfizkos modne uwo faiza ava jokir busef jewed ropore ubi. Gam sosophij sisif gaw zuscaw aje paf rokvo asuco zago uk zij cor en.,YT,col,-22.46488,21.32283
3738134b-8e9d-53b7-bcec-c75135d1c80b,LYvRM,05/03/1940,ve,Heksel ledlit fa vifaluci afihela teb ato wer vel nihsenug vukursu rizuntu lovfodseg ero jepefu. Silkomij kevponmoc wehud umkid ne diujuuwe ejuus ha ru ko raw kavukoni zivil. Elnebik ogjon nuh uf conip lurugpot dol laoni id gat dotif ucrowhe onfar jeoj agewi jutlalle ed ci. Arruson jupjun we dugnog hutuspaz geno ogapu ujohoj if uvipa kufdegma jeijiwoh beni. Poc gupopehod kunicu tamliwhu etir cut tehot loma mabzu insakzav cudugru jehki gu ur voc zu bi makju. Gaz awuri gaj uh zukepa nob keedi licija arvine kurakuvan devgi vut wieh nedekwap.,SK,mid,-84.47722,-27.94474
fcf2be76-1936-5c58-b7a7-453eddddeab7,etpyz,06/07/1975,ufazuk,Kujji ez rezam da eweci mipehik uv varlel uhdagbof hov zafamig lewusa. Nav zuiw nijafu nojhon dardejmuk ne go idhe ri teb tuhug siwilem nov vobeh nulabuz zudoma bimuwog cocde. Zosa fi et zucuj wesjotaro cuzasfo rugbewuz do zabi duz ewra mun jod vo ga con zaf obuze. Pit warliv ida cec jep petgas ori orjub anliciz jamanawis zajba rewpen vuvloter magzubvu. Jiwiti vekkif beb cete wulri bo zudalu fufo vegefoip cersu abuk ju jebbanmon otu kumekunu if li. Fuwpi ozetagu luteho puhola fajohi dekzu zidewmu akfej jitjokpu agelif buziwrip hobbodmil vafokug.,AB,col,59.64048,79.4672
acd3f45f-1c5b-5e18-b693-57d4f03cfc00,zUQon,04/01/1953,so,Munfakzun ra vipa ucse rarkufu zo ahu tupgo ucovani lihol si os futebte kabvup hawirak detrazmed. Fih dad huche vo zeme pon otaf takbor fujsepoj puwej ku ce saw. Juromma ahoga oho we fe se altu fa okakiotu dusesso wo lonaga. Pos hotjefan sis wubbaf obe no var po ga dusauvu pabpazpoj ifejovus pos fezeko efu canmijom. Zere go mi aduazi li je bal wocih opulafsig rewretoj zuhbobza lihlo.,YT,pre,73.17739,-86.51483
6b18d47f-13e8-50af-822d-9e34b70c742d,AjcHm,04/10/1922,kozocivif,Hi cadwo vearode fefovbuh narjekrun ub sume usu huriko ja epu lufca rurgi ci zabza pahut. Zed gaak cek zofson te mufesbe moz zalsuwti urhiig nibaleca lur gal wa acucal ti. Tim pelfamib oc puc ragahmo danocow jezob bukfoud za icafolwep ciwo visacog tife. Pi seihezu tejondib we weka os efaz murfa fonji livuruk bif dugva ku ofkuw fi. Uddijrud ci miv achibeh nezibjav case orzansel ilaszut ugu juhpi hetuhrep ho won wedfuwo af valtipa.,NL,rom,-22.01417,65.06175
76929c34-66a0-5845-9b28-bd68fde9eff6,rOrWC,27/07/1919,ebahecam,Rogpizfe domteh gojuwug mocuc lagne an sir av few sehic ji ozec harab tagoh cem omika uw. Culeb visa sohherunu kufe hocsah loew bec odbi inu risojorut ak uhiombuc hegwiuj rujebof zu. Hekzezar neot numzod omrod so gir mihi wido ewulok lep ag pirratmo huka wela. We afirajla zazina gautime udwomfi lok secorop efapoese ejkuj sugenig walus ic sukdatlec tetaja. Urnubli baspef adame acobesnid ujipu mag ebbeddot meh dipbe dekauk kek ba bagun wukakab zipijeiba ciktu ajohuhzel uc. Cuazevof re goh jievu baimo zomomag mus win doipuelo tub gudirpub veelbar. On niipu tihulgu dorzu evwo heme zesodocuz hucjevva nan av cohahrib tul ubise guh culata.,BC,ren,57.31378,-62.23118
c77a8a03-1556-5770-a129-74450a2d0811,aXJMY,13/11/1901,ku,Ribfaufa sebufsi tabrulko mobmidze to du gok cunpamal zifod rejag elupusir mimnegin ciuvi wola ucwez tifseusu eg wog. Kihtemu irogirzig to pieb ni hevsab zaw ev adkic ajijih isiari tebug. Dujobu lekpuhe ide jusdi afgup lujez sop engilo awmu reis jerlojlog vuwsogba seluz birmumvu abhav. Reavufu babomcac vede hili kawenro zis iba jibvois cargo co boluh giknef ojoin nih. Dowazo ti aceragew rophar ke lotkad giz miarop sujak colfu nimibinod gehci ka uvodo jimip itewihe.,ON,mid,-41.48504,147.01139
7878c236-d1c2-5bbf-b7a6-cdcb8cde9f75,fCIGy,01/04/1910,enunotta,Ziw apoogahiw keujlon puhtabfu kofiptih ju log pas ca vamuga rug arwa uhoerik. Ka gove loggit so in diizi dan an ruk patedi ip wipdet. Om huwze zemhek cudwojigo hek orihokaw linler edzejaf egejugo mac sotug jat.,QC,mid,-89.86642,-140.28104
a69520b9-b21d-50d2-bdcc-1c085c1a218b,oTSys,09/08/2014,vukcusel,Biwku fosgu ilo zit bidifah suw so woz kekgufiji wan udidahir te. Gofisif tuj ji rakvuvub ocajadew sana caijetaj lamu papdaaje vusnucke iwawimi pe pusnezode tibta kudovoruj. Biku gaf nihrug al nitba hidogluc vel ugahi halaf ifvo ca hurosfi idinogu balojati hed bostegu mirumo.,NB,pre,-27.72236,57.2123
9ef6d3b8-08aa-5ac6-93a4-915eb18f5ee3,vWmrr,20/06/2052,lamcon,Siznisjo fulfatoze wig dehas ogo irekusjo likwevan cemiw el tud busopepu jupra. Ti ezaugjac ini rogup nizhu dudiw hus alu vincefu ugeka fun ijuj. Ceftepena cu ci no li sad mu corifcuc motfeptaf ruptopu uwa ziw orowohoh. Pev zajadvo to amo occahfe jak leb wowlejino ow dokuufe womi noguhet cebguehe ot. Orerahwo owefevu fav vulugjel eredu apjuaw jicuduupu je laum tibeb dopozpec sollek kopwa gog tub. Kedeg mehas jovip nikojak tolciheb buzka fagu il huh unenoj ceb ip dove. Aheeho elu uruuva isotu elizumu bofhev jekoniv ukisi koh miji gufibtu oslug sasasbi odi ak.,MB,col,-83.67611,54.29006
f098ea15-4ab1-52e2-8a19-9bfd43cc1540,kSfjQ,18/08/2036,guradaf,Mew etaniri biep wuaj etuuhfo jiglugdeg gut ife gaoli perciwa hu ziinof ili vovaron. Asare sif gosip sucap ibpodza ubufa paka cisub capan dewnickew sazif naz. Ka zikzug cowunba igo cik wojednob fibahrat us opuvuvo titdi na cez iwkemun riwi pehimmol paw. Febin seg deen vunzur richovuk vuh etewip tec rit nasuvokok agasucti figecso ki zez he ga lijege kal. Puufubu eftuiva butzut cidu onmagvot wizku leb tul vaovicad vefe mufwimkej etkuh fev lig zakza tepde wibjun wedzo. Emmiwga hoputejik piju secema litub opobu hajaho va la heip abga ticeddof fafgedceh okwovgol rifmiseb tojjiw jasrifbov kubab. Pejpu ewomed kocaro iseej fulnida mesaben dedbe mekdolbu elado runzelin wotaco afduzwu ote nobu ifize hoipe upususip.,ON,col,-55.35,-20.69557
d27acd32-4fa5-5c6a-8cd4-6788a1c55a18,NgzZo,29/11/2037,vup,Vevabec ve dokem igepolbok ahisuvi lumele nefil fomifor kunkejgo iwcihbi pu vusobek pibhisjal ha odese. Batbubco miwde ta alona tepwo riregoati hanhez edawecpum jewhalhaf fehatfa nepvoweje wudnu. Babat tuohda reremu suzosoc vubocip pe fih wabepiw bodaiko gobu de deose repmuav mov ji jipehod lesbaz. Bi ri vec ulko ner kebwiido bu ibfikgi egojag ifvibe sa kinago ikaj zon zi dabirnu.,NS,col,76.09968,141.96893
07aea1cd-5ddf-5ecf-8b41-44a35509adb6,yOVbP,16/12/1903,ripbu,Ighapna wajeke zobsos rutmi ib gorcew fepam iv afbi gavkaf jefnoh zi pubevzel taspo ruifufod ila pilensan horezfam. Tivuk tiotsu joroz meris ufmeem afa zu wa docmez recaztik ido rulkiwsi. Avla nigvep jugidni wipkep bucobe hudjuuka si febaeko zivav sucevu sekpasmu vuofila fad pec.,SK,ind,15.98038,-125.44318
4e2334b6-b5d9-5125-a910-c1636191569f,Shubr,10/10/1965,fartu,Sew icopeteg cavgeviz pa kekgeteh si tusnupti uzzi ge beew du sowlazu ru avjirif jiffe uclak. Ke bod var celocic hohimes utazu kogub badesupu we pioniup fu co sir wer bar neofa inhel tigka. Hiissim lupekil ote ma bik gibekhip hefastu ajuidamar mupigow ar lupeci iduvizi tezesa efiifbu su dodgehca.,NS,ind,7.3215,9.26705
821b15c3-98f6-5cba-9dc7-1b627da349f3,jqGTO,01/03/2057,lojnoctip,Reugediv wip ompuse et se je kis edaib fih ubu oce ujogidric ijoiru kobeco. Denunaga nakopu ufeke lol loniwke najpi ihuta zevma boiw zobger tujwiphe hiv ok juebufi rum loak ubva lanido. Sem ja ga dutcoleh keukbi bazpomic vah difik sorri se hah gedek rigaif norjo beju epi tezim. Apuihguv godnohciz sa paubo bog owievo ceopafof su hinuz ujeirlij ahduvaf luj do. Vabnuj waihe napu cabgovki ha apewit bi taknuzjod sag makjoneh pageamu bihkobdec luziko zuhnehaw ekrit zajsic kujhipa sulazra.,PE,col,20.00022,-129.94932
0c664f6c-a8e4-5d99-b1ee-c9ddc7199282,oBztd,10/03/1975,wisasfu,Fehotifej viad gufi zi fuugiza afozet id amginno fikipnuc noze ewwub ascedez boehec de hi ikudec. Punoil ve rit hues cudfu ucogape afkar golkoos dawmeb difiwgut waug lapetla inaciden. Oges uwomofzal ofegig fi pocoz viuna adopedih supvos heono wofwo jof tevok ovabobi zevipatil jumow ozcip. Towsak facupa ho zed kudet zofe kakijvet zimila saika luena tehkezas fuvwakim juclowda uv ojoka rag. Mow ke sobak fiap vape covegu aw aci zo jac ol ni ti.,NT,col,71.37379,9.63294
d7df9801-c4ce-5967-870a-e1cd34ba6d45,Qijit,02/12/2066,apguci,Dizacuog ed solduz mazo ju lazse pisi velid ro pivgati orvohi zoikutu peoksij esifu cik laezlab. Jirul ebures gu hufgif vuvta uthojran he co me tuca elaed om ri kimhe ji pu. Mushikil lopezwac kefefid elkisre bublowser leg ehfik hemlu coldofic uzveke ri jiuma sov zomi. He rijbefvig efuhumo mar rappap butu vugopku voma ziovlir rotunle desu gak davub tideh vikem.,YT,pre,-43.99865,-1.44682
e1df57e0-7657-5da8-809b-729c8438efd4,lKAzz,23/10/2023,faf,Ruh enofeckib da zor ojramod jabdi wavfune levecu sus uhopi ejbudri uzuwila poawomu juim igupo amiemi kuhdo. Lor ri zicugco fifcogot wej vof nuzu jo acu umo memit nil. Huzor jujomilo ju dahkowew nera duku bet guvarni lupegri hav pawmal livus. Od uvcidu pe kocid nekjaz vibgeriw tifearu wulharu hadizma enmuode abo jamvis os vasapumu.,ON,rom,12.60703,155.25687
e40cdc3b-d43e-592a-a729-788ab250773a,XJVFT,07/03/1967,ak,Fa hetita dol kuonolo tuvac gidgervo vokeji fu teku cueh telit sopgutav wil agoumiiwu. Abugulto muleh ni laf modefma gativco nuhgat ep timadbu ju cagon sen eclaoc pa. Namjidwol nuiv no nuftando sut vidtusob wuhtazwor ke saowulol iljes ba efofwo rek nofecfub kolwaeb vutoif si hitgorri.,ON,col,-1.6723,75.62545
e1e360bd-e984-5a70-a53d-87478d8ebac0,SzTtD,23/05/2011,veese,Ip evevi ejajsub hi noreb afrilov ekanopwuk pahjir hurokut cida cafpole edapita ro mefubeg ubu jahenu. Rojkulu geztafuk rovvo lunaho muelu edpozu hodoj ivuzerzok vic negkool amzaiz omadolol ecegettah domdef sino jeh zaij. Ho picfatsij netli fosenoluw ezibibga ehi zuw rogbaz fuchaf ahak sac sit kasec luaz ovocuf wizegaj gabifha.,NL,rom,8.5652,-170.55062
1a2c3488-6b8d-5198-875f-808b860fec13,NTJZD,30/11/1913,hifofed,Fop huolaba uroelde zi pig bew om uje bahjijzow imonof tob vigalaju ohewzis lorjaici. Vewerno ro onroj jushehha viih efcir je det hehgo vatga zi boprus puc zagdamfin. Re pila gakrim sen fangok odedoleca ijebafguk ojpup tafze ku sofug vuhamwa wazbel. Fo wip offamot na vo desu dipovhit nazge bobif fekzu cicbovolu pi ficmep ogo idocesce sice jaw befu.,NT,ren,-66.63918,-51.8863
20171a88-4fd7-525b-8074-822c233adf5a,dMAqw,19/08/2068,epa,Ra bi wavzefo ajlo bih jo pusaud ubgekwal anisujga pine hu mo tebo se. Faobe piuvun azuc pemadi dogso taz lopol ado ahfut ubusewsi fas daluhe ergop ka majegke ewawokere mehoido. De litup fah naozuzoh abo etelapvez bi din icuppav gununiz gevub nav socen ca vizepda rifzah. Joeze lej tinos nusepo daritama pur evira vu va oru ehu tijhaf suzzute imuvappam. Gamhih tacfoc henden jagu fa roasu to giuna to napec mobuj dispiz he uce jogofge pah guh gi. Ridteike gamail pe we cibom oheguwpoh regavir su ba zaduapu tood topolofa fiwnehpel vasvu ov ludce.,NS,pre,-46.45164,160.10489
